{
  "results_format": 1,
  "suite": "brain-protocol-tck",
  "suite_version": "2.0.3",
  "kit_commit": "31c32cd",
  "class": "D",
  "target": "http://localhost:8097",
  "adapter": "../providers/real-bedford/adapter.ts",
  "started_at": "2026-06-21T14:45:02.272Z",
  "completed_at": "2026-06-21T14:45:03.088Z",
  "environment": {
    "node": "v22.22.3",
    "os": "linux 6.8.0-124-generic arm64"
  },
  "summary": {
    "total": 46,
    "passed": 46,
    "failed": 0,
    "skipped": 0
  },
  "verdict": "pass",
  "tests": [
    {
      "id": "T-ENV-01",
      "suite": "ENV",
      "class": "D",
      "name": "envelope rejection",
      "clause": "BP-01 §5 / AC-01.1",
      "status": "pass",
      "message": "BP-01 §5 / AC-01.1: passed",
      "evidence": [
        {
          "label": "valid controls",
          "detail": {
            "accepted": 4,
            "rejected": []
          }
        },
        {
          "label": "invalid variants",
          "detail": [
            {
              "label": "entity missing id",
              "rejected": true,
              "reasons": [
                "(root) missing required field: id"
              ]
            },
            {
              "label": "entity missing type",
              "rejected": true,
              "reasons": [
                "(root) missing required field: state",
                "/id must match pattern \"^urn:brain:[a-z0-9][a-z0-9-]{0,63}:activity:\"",
                "/attributes missing required field: title",
                "(root) must match \"then\" schema",
                "(root) missing required field: subject",
                "(root) missing required field: object",
                "/id must match pattern \"^urn:brain:[a-z0-9][a-z0-9-]{0,63}:edge:\"",
                "(root) must match \"then\" schema",
                "(root) missing required field: state",
                "(root) missing required field: summary",
                "(root) missing required field: payload",
                "(root) missing required field: requires_confirm",
                "/id must match pattern \"^urn:brain:[a-z0-9][a-z0-9-]{0,63}:action:\"",
                "(root) must match \"then\" schema",
                "(root) missing required field: type"
              ]
            },
            {
              "label": "entity missing subtype",
              "rejected": true,
              "reasons": [
                "(root) missing required field: subtype"
              ]
            },
            {
              "label": "entity missing source",
              "rejected": true,
              "reasons": [
                "(root) missing required field: source"
              ]
            },
            {
              "label": "entity missing external_ref",
              "rejected": true,
              "reasons": [
                "(root) missing required field: external_ref",
                "(root) must match \"then\" schema"
              ]
            },
            {
              "label": "entity missing owner",
              "rejected": true,
              "reasons": [
                "(root) missing required field: owner",
                "(root) must match \"then\" schema"
              ]
            },
            {
              "label": "entity missing visibility",
              "rejected": true,
              "reasons": [
                "(root) missing required field: visibility"
              ]
            },
            {
              "label": "entity missing sensitivity",
              "rejected": true,
              "reasons": [
                "(root) missing required field: sensitivity"
              ]
            },
            {
              "label": "entity missing valid_time",
              "rejected": true,
              "reasons": [
                "(root) missing required field: valid_time"
              ]
            },
            {
              "label": "entity missing system_time",
              "rejected": true,
              "reasons": [
                "(root) missing required field: system_time"
              ]
            },
            {
              "label": "entity missing attributes.name",
              "rejected": true,
              "reasons": [
                "/attributes missing required field: name",
                "(root) must match \"then\" schema"
              ]
            },
            {
              "label": "activity missing owner",
              "rejected": true,
              "reasons": [
                "(root) missing required field: owner",
                "(root) must match \"then\" schema"
              ]
            },
            {
              "label": "activity missing state",
              "rejected": true,
              "reasons": [
                "(root) missing required field: state",
                "(root) must match \"then\" schema"
              ]
            },
            {
              "label": "activity missing attributes.title",
              "rejected": true,
              "reasons": [
                "/attributes missing required field: title",
                "(root) must match \"then\" schema"
              ]
            },
            {
              "label": "edge missing subject",
              "rejected": true,
              "reasons": [
                "(root) missing required field: subject",
                "(root) must match \"then\" schema"
              ]
            },
            {
              "label": "edge missing object",
              "rejected": true,
              "reasons": [
                "(root) missing required field: object",
                "(root) must match \"then\" schema"
              ]
            },
            {
              "label": "action missing summary",
              "rejected": true,
              "reasons": [
                "(root) missing required field: summary",
                "(root) must match \"then\" schema"
              ]
            },
            {
              "label": "action missing payload",
              "rejected": true,
              "reasons": [
                "(root) missing required field: payload",
                "(root) must match \"then\" schema"
              ]
            },
            {
              "label": "type goal (invalid as a primitive)",
              "rejected": true,
              "reasons": [
                "/type not in [\"entity\",\"activity\",\"edge\",\"action\"]",
                "/id urn rtype 'entity' contradicts type 'goal' (BP-01 §4)"
              ]
            },
            {
              "label": "urn rtype contradicts type",
              "rejected": true,
              "reasons": [
                "/id must match pattern \"^urn:brain:[a-z0-9][a-z0-9-]{0,63}:entity:\"",
                "(root) must match \"then\" schema",
                "/id urn rtype 'activity' contradicts type 'entity' (BP-01 §4)"
              ]
            }
          ]
        }
      ],
      "duration_ms": 11.85
    },
    {
      "id": "T-ENV-02",
      "suite": "ENV",
      "class": "D",
      "name": "bitemporal backfill",
      "clause": "BP-01 §6 / AC-01.2 (CD-5)",
      "status": "pass",
      "message": "BP-01 §6 / AC-01.2 (CD-5): passed",
      "evidence": [
        {
          "label": "round-trip",
          "detail": {
            "sent": {
              "vt": "2019-04-01T00:00:00Z",
              "st": "2026-06-11T09:12:00Z"
            },
            "got": {
              "vt": "2019-04-01T00:00:00Z",
              "st": "2026-06-11T09:12:00Z"
            }
          }
        }
      ],
      "duration_ms": 3.73
    },
    {
      "id": "T-ENV-03",
      "suite": "ENV",
      "class": "D",
      "name": "degenerate bitemporal form",
      "clause": "BP-01 §6",
      "status": "pass",
      "message": "BP-01 §6: passed",
      "evidence": [],
      "duration_ms": 2.95
    },
    {
      "id": "T-ENV-04",
      "suite": "ENV",
      "class": "D",
      "name": "goal duality",
      "clause": "BP-01 §3.2 / AC-01.3 (CD-9)",
      "status": "pass",
      "message": "BP-01 §3.2 / AC-01.3 (CD-9): passed",
      "evidence": [
        {
          "label": "goals stored",
          "detail": [
            {
              "type": "entity",
              "target": "complete a 10k race"
            },
            {
              "type": "activity",
              "target": "complete a 10k race"
            }
          ]
        }
      ],
      "duration_ms": 4.62
    },
    {
      "id": "T-ENV-05",
      "suite": "ENV",
      "class": "D",
      "name": "vocabulary valve",
      "clause": "BP-01 §11 / AC-01.4 (CD-6)",
      "status": "pass",
      "message": "BP-01 §11 / AC-01.4 (CD-6): passed",
      "evidence": [],
      "duration_ms": 3.41
    },
    {
      "id": "T-ENV-06",
      "suite": "ENV",
      "class": "D",
      "name": "unknown scope fails closed",
      "clause": "BP-01 §8 (CD-6)",
      "status": "pass",
      "message": "BP-01 §8 (CD-6): passed",
      "evidence": [
        {
          "label": "stored visibility",
          "detail": "private"
        }
      ],
      "duration_ms": 3.45
    },
    {
      "id": "T-ENV-07",
      "suite": "ENV",
      "class": "D",
      "name": "derivation rule",
      "clause": "BP-01 §12 / AC-01.5",
      "status": "pass",
      "message": "BP-01 §12 / AC-01.5: passed",
      "evidence": [],
      "duration_ms": 8.55
    },
    {
      "id": "T-ENV-08",
      "suite": "ENV",
      "class": "D",
      "name": "urn round-trip",
      "clause": "BP-01 §4",
      "status": "pass",
      "message": "BP-01 §4: passed",
      "evidence": [
        {
          "label": "urn",
          "detail": {
            "sent": "urn:brain:garagebrain:entity:00000000-0000-4000-8000-000000000001",
            "got": "urn:brain:garagebrain:entity:00000000-0000-4000-8000-000000000001"
          }
        }
      ],
      "duration_ms": 3.14
    },
    {
      "id": "T-ENV-09",
      "suite": "ENV",
      "class": "D",